{
  "id": "vscode-extension-install",
  "category": "developer",
  "title": "Install the Prettier VSCode extension",
  "difficulty": "easy",
  "goal": "Find the marketplace listing for the Prettier VSCode extension and report its install command.",
  "constraints": [
    "Source: marketplace.visualstudio.com"
  ],
  "start_url": "https://marketplace.visualstudio.com/items?itemName=esbenp.prettier-vscode",
  "expected_steps": [
    "navigate marketplace",
    "open Prettier listing",
    "extract install command"
  ],
  "critical_actions": [
    "marketplace.visualstudio.com",
    "prettier",
    "code --install-extension"
  ],
  "rubric": "Reports the marketplace listing and `code --install-extension` command.",
  "final_answer_check": {
    "mode": "contains_all",
    "value": [
      "prettier",
      "code --install-extension"
    ]
  },
  "final_answer": "Prettier \u2013 Code formatter (esbenp.prettier-vscode) on marketplace.\nInstall via CLI: `code --install-extension esbenp.prettier-vscode`."
}
