{
  "id": "python-latest-version",
  "category": "search",
  "title": "Latest stable Python version",
  "difficulty": "easy",
  "goal": "Find the latest stable Python release version and release date.",
  "constraints": [
    "Source must be python.org or PEP index"
  ],
  "start_url": "https://www.python.org/downloads/",
  "expected_steps": [
    "navigate python.org downloads",
    "extract latest version",
    "note release date"
  ],
  "critical_actions": [
    "python.org",
    "download"
  ],
  "rubric": "Reports the latest stable Python version and release date.",
  "final_answer_check": {
    "mode": "contains_all",
    "value": [
      "python",
      "3."
    ]
  },
  "final_answer": "Latest stable Python release at time of writing: Python 3.12.x (3.12.3 as of 2024-04; 3.13 in pre-release). Supports back to 3.9."
}
